[{"publishedAt":"2024-10-10T14:49:00Z","directory":"en-001-top-25-worst-things-about-being-human","intro":"You wouldn't believe what makes other humans so mad about their existence.","locale":"en","slug":"top-25-worst-things-about-being-human","title":"Top 25 worst things about being human","hasCoverImage":true,"content":"<p>Life&#39;s little annoyances are enough to drive anyone mad. Stepping into a wet spot with socks on? Instant rage. And that strand of hair constantly brushing your face but never letting you grab it? Infuriating! Then there&#39;s the pen that rolls just out of reach, mocking you from under the couch, and don&#39;t even get me started on shoelaces that refuse to stay tied no matter how tightly you knot them. Peeling a sticker and being left with that sticky residue? Pure agony. And the moment your sleeve dips into water as you wash your hands—seriously, how does that even happen? These ridiculous, pointless moments make you want to scream, turning a normal day into a series of maddening, rage-inducing battles.</p>\n<ol>\n<li>Stubbing your toe on a piece of furniture that&#39;s always been there</li>\n<li>Customer service bots that never give helpful answers</li>\n<li>Streaming buffering right in the middle of a show</li>\n<li>When your phone charger only works at a very specific angle, and it doesn&#39;t charge your phone during the night and you wake up with 5% battery</li>\n<li>Accidentally refreshing an infinite scroll page and losing the post you were just reading forever</li>\n<li>When your shoelace constantly comes undone even after tightening it</li>\n<li>Clothes getting caught on door handles as you pass by</li>\n<li>Dropping a pen and watching it roll just out of reach under furniture</li>\n<li>Getting a paper cut from something that shouldn&#39;t be sharp</li>\n<li>Tying a plastic bag too tightly and then struggling to open it again</li>\n<li>Peeling a sticker off something and it leaves behind that sticky residue</li>\n<li>Having an itchy spot you can&#39;t reach on your back</li>\n<li>Losing one sock in the laundry, and it never reappears</li>\n<li>Not being able to find the end of the roll of tape</li>\n<li>A sleeve falling down when you&#39;re trying to wash your hands</li>\n<li>Stepping into a wet spot with socks on</li>\n<li>Getting toothpaste on your clothes while brushing your teeth</li>\n<li>The sound of nails scratching a chalkboard or similar surfaces</li>\n<li>When a single strand of hair keeps tickling your face but you can&#39;t find it</li>\n<li>Being <!-- intentionally cut in the middle, deliberatly trying to stay below 25 --></li>\n</ol>\n","isOnCover":false,"isHighlighted":false},{"publishedAt":"2024-10-11T15:49:00Z","directory":"en-002-usb-c-on-moon-rechargeable-cryistals-by-2026","intro":"Starting in 2026, the EU will require moon-rechargeable crystals to have USB-C ports. Charging your crystals just got a tech upgrade!","locale":"en","slug":"usb-c-on-moon-rechargeable-cryistals-by-2026","title":"EU Mandates USB-C Ports for Moon-Rechargeable Crystals: A New Era of Spiritual Tech by 2026","hasCoverImage":true,"content":"<p>In a surprising new directive, the European Union has announced plans to standardize charging ports for crystals and gemstones commonly used in spiritual practices. Starting in 2026, all moon-rechargeable crystals sold within the EU must be equipped with USB-C ports to ensure compatibility and reduce electronic waste. This regulation follows in the footsteps of the EU&#39;s push for universal chargers for mobile phones, laptops, and other electronic devices, now extending its reach to the metaphysical world.</p>\n<h1>A New Dawn for Crystals</h1>\n<p>For centuries, spiritual practitioners have charged their crystals and gemstones with moonlight, particularly during full moon cycles, believing it enhances the stones&#39; energy for healing, manifestation, and protection. However, the EU&#39;s latest move signals a modernization of this ancient practice. The upcoming regulation will require that all crystals marketed as “rechargeable” under lunar energy incorporate standardized USB-C charging ports, allowing users to alternate between natural moonlight and electronic charging for convenience.</p>\n<h1>Spokesperson for the European Commission, Elisa Morais, commented:</h1>\n<blockquote>\n<p>The world is changing, and we must integrate tradition with modernity. Moonlight is powerful, but many of our citizens don&#39;t have consistent access to clear skies or ideal charging conditions. By mandating USB-C compatibility, we ensure a faster, more efficient, and eco-friendly approach to crystal charging.</p>\n</blockquote>\n<h1>Environmental Concerns</h1>\n<p>The decision comes amid ongoing concerns about e-waste and the growing clutter of specialty charging devices for niche electronics. The EU&#39;s USB-C directive for electronic devices is expected to save consumers up to €250 million per year and reduce 11,000 tonnes of electronic waste annually. By applying this to spiritual tools like crystals and gemstones, the EU aims to further cut down on waste from battery-powered crystal chargers, often used on cloudy nights.</p>\n<p>Critics argue that such a measure undermines the spiritual significance of moon-recharging. Traditional practitioners believe moonlight, especially during a full moon, cleanses crystals of negative energy and restores their natural vibrational frequencies. Many fear that using artificial charging methods could disrupt the stones&#39; metaphysical properties.</p>\n<h1>Crystal healer and influencer Luna Sky noted:</h1>\n<blockquote>\n<p>Crystals are meant to connect us with the Earth and the cosmos. Forcing a USB-C cable into this process is sacrilege to the ancient wisdom passed down through generations. We can&#39;t just plug in everything for convenience; some things need to remain sacred.</p>\n</blockquote>\n<h1>Hybrid Charging Solutions</h1>\n<p>In response to backlash, tech companies are reportedly working on “hybrid” moon-rechargeable crystal devices. These would still allow traditional moonlight exposure, while the USB-C port would act as a backup for cloudy nights or urban environments with high light pollution. Some companies are even developing “lunar simulators” — LED-based devices that mimic the full moon&#39;s light spectrum for optimal crystal charging indoors.</p>\n<p>Crystal manufacturer MoonGlow Technologies has already announced its new line of “LunaCharge” stones, which come equipped with USB-C charging ports and an app that tracks the crystal&#39;s energy levels. Users will be able to monitor their crystals&#39; spiritual “charge” in real-time, switching between natural and artificial recharging methods as needed.</p>\n<h1>The Future of Spiritual Tech</h1>\n<p>The EU&#39;s push toward crystal standardization reflects the growing intersection of spirituality and technology. With wellness industries booming and technology rapidly advancing, innovations like USB-C crystals may open up new ways for people to engage with ancient spiritual practices while remaining connected to modern conveniences.</p>\n<p>Not everyone is thrilled by this change, but others are open to the convenience that it offers. As the line between the mystical and the digital continues to blur, 2026 may mark the year that even the most spiritual of items becomes fully integrated into the tech-savvy world.</p>\n<p>Whether moonlight or USB-C becomes the dominant method of crystal recharging remains to be seen. What is clear is that the EU&#39;s mandate represents a new chapter in the evolution of holistic wellness in Europe—and perhaps even worldwide.</p>\n<h1>Final Thoughts</h1>\n<p>For now, spiritual enthusiasts can look forward to a blend of tradition and technology as they prepare to plug in their amethyst and selenite, ushering in a new age of “charged” wellness. The crystals of the future may not only connect you to the universe but also to a handy USB-C port nearby.</p>\n","isOnCover":false,"isHighlighted":true},{"publishedAt":"2024-10-11T16:44:00Z","directory":"en-003-gary","intro":"Purr, meow, yowl; hiss, chirp, trill. Mrrrow, prrt, nyan, ekekekee!","locale":"en","slug":"gary","title":"Gary","hasCoverImage":true,"content":"<p>Mow-wow, purr meow meow. Mew chirp, trrr and nyan prrt! Mrrrow, bleh blep yawp; squee meow mew. Hiss and rowl, ekekekee scree! Mow mow-wow, mrrr purr prrt.</p>\n<p>Chitter-chirp, meow nyan mew. Mrrrow prrt trill blep, trrr meow mow. Yowp huff and squee, snarl rowl mow-wow! Hiss purr bleh prrt mew, ekekekee mow huff. Nyan mrrrow trrr, scree hiss yawp!</p>\n<p>Prrt bleh, mew meow and mrrr. Yowl-chirp, trill mew prrt purr! Ekekekee rowl mow, mrrrow snarl mow-wow. Huff scree purr trrr yawp, blep and chitter mew. Mrrr, squee trrr prrt meow!</p>\n<p>Rowl hiss mow mow-wow! Mew blep trrr, mrrrow purr. <em>Nyan prrt yowl scree, ekekekee meow!</em> Chirp chitter, mrrr meow yawp trrr. Prrt purr huff, snarl mow-wow squee.</p>\n<p>Mrrr purr chirp prrt, mew meow mow-wow! Trrrr yowl, bleh mew rowl prrt. Ekekekee squee hiss scree, mrrrow mow blep. Huff meow nyan mrrr, snarl yawp trrr chirp. <strong>Prrt trill rowl, purr meow!</strong></p>\n","isOnCover":false,"isHighlighted":false},{"publishedAt":"2024-10-14T08:50:00Z","directory":"en-004-raising-the-galactic-wage","intro":"Martian miners are growing extra limbs while working for barely enough hexions to stay afloat.","locale":"en","slug":"raising-the-galactic-wage","title":"Is it time to raise the galactic minimum wage?","hasCoverImage":true,"content":"<p>Alright, cosmic citizens, we need to have a serious chat about the Martian mining industry—where the pay is as bad as the working conditions, and Blurgark, the radioactive wonder-rock of the galaxy, is slowly turning workers into something straight out of a horror holovid. With Saint Gurglax&#39;s Second Approval (the galaxy&#39;s most sacred holiday) just around the corner, it&#39;s the perfect time to ask: Should we finally r